"PROGRAMA DE GOBIERNO  ‘BOGOTÁ PARA LA GENT E’ 	1 
programas de Educación para el Trabajo y el  Desarrollo Humano 
pertinentes, y talleres y cursos libres digitales y presenciales para el 
desarrollo de habilidades blandas ala ciudadanía de todas las edades  
 
106. Promoveremos la creación de Circuitos de Empr endimiento Social y 
Comunitario en cada localidad , que funcionarán en espacios de"
"PROGRAMA DE GOBIERNO  ‘BOGOTÁ PARA LA GENT E’ 	33 
	
trabajo compartido, en los que se brindará acompañamiento integral a 
los emprendedores. E starán enfocados en desarrollar las capacidades 
de las personas en todas las etapas d e la vida y ofrecerán programas 
de formación y de acompañamiento económico y psicosocial, 
sirviendo como apoyo a la oferta de la Secretaría Distrital de 
Integración Social.  
 
107. Ofreceremos líneas especiales de apoyo a emprendimientos que 
promuevan la generac ión de oportunidades de empleo  a jóvenes, 
mujeres, especialmente mujeres cabeza de hogar, personas mayores y 
personas con discapacidad y sus cuidadores.  
 
108. Conectaremos las Casas de la Juventud  a los circuitos locales de 
emprendimiento y promoveremos el apoy o a iniciativas de jóvenes en 
el marco de la Ruta de las Oportunidades para Jóvenes enfatizando en 
la orientación vocacional.  
 
109. Fortaleceremos la oferta del Programa Distrital de Estímulos para la 
Cultura  y apoyaremos el arte urbano con una estrategia espec ífica de 
acompañamiento, desde el Sistema Distrital de Apoyo al 
Emprendimiento.  
 
110. Apoyaremos emprendimientos relacionados con las Industrias 
Creativas  desde el Sistema de Apoyo al Emprendimiento; 
promoveremos la conformación de circuitos artísticos en cada  
localidad y la realización de concursos y eventos itinerantes en las 
localidades con menor acceso a la oferta cultural y artística."
"PROGRAMA DE GOBIERNO  ‘BOGOTÁ PARA LA GENT E’ 	34 
	
Ambiente de Inversión y Productividad  
 
111. Implementaremos un programa de formalización y mejoramiento de la 
productividad  de micro, pequeñas y medianas empresas  que les 
permita acceso a crédito, con el apoyo de la Alcaldía, apropiación de 
tecnología y asistencia técnica para la mejora continua de procesos y 
modelo de negocios.  
 
112. Fomentaremos el aprendizaje de una segunda lengua en todas las 
etapas de la vida a través de ofertas gratuitas de programas de 
aprendizaje. Intensificaremos la apropiación de segunda lengua en 
Instituciones Educativas y en los Centros de Desarrollo Comunitario.  
 
113. Continuaremos el desarrollo del Bronx Distr ito Creativo  mediante la 
generación de incentivos tributarios a empresas de Industrias Creativas 
y el apoyo financiero a proyectos conjuntos entre Instituciones de 
Educación Superior, de Educación para el Trabajo y el Desarrollo 
Humano, apalancados en el F ondo de Innovación, Tecnología e 
Industrias Creativas.  
 
114. Promoveremos la creación de Distritos Creativos adicionales  en otras 
zonas de la ciudad, que respondan a vocaciones territoriales 
claramente identificables en el ámbito del desarrollo urbano de la 
ciudad y reflejen la diversidad étnica y cultural de la ciudad.   
 
115. Promoveremos la atracción de capitales internacionales  para que 
inviertan en emprendimientos de base tecnológica. Bogotá debe 
convertirse en la ciudad más atractiva de América Latina para la 
inversión."
"PROGRAMA DE GOBIERNO  ‘BOGOTÁ PARA LA GENT E’ 	35 
	
116. Apoyaremos la diversificación de la oferta exportable de las micro, 
pequeñas y medianas empresas  y adelantaremos  una estrategia de 
apertura de nuevos mercados para sus bienes y servicios.  
 
117. Adelantaremos un plan de simplificación de normas y reg ulaciones 
distritales  que promueva la productividad de las empresas y facilite 
hacer negocios en la ciudad.  
 
118. Junto con las Universidades y el Sector Productivo, pondremos en 
marcha un plan a corto y mediano plazo para participar de manera 
protagónica en la  Cuarta Revolución Industrial,  que permita que la 
ciudad fortalezca sus capacidades de infraestructura y talento humano, 
y se convierta en la capital latinoamericana de la innovación.  
 
119. Apoyaremos la creación del Distrito de Ciencia, Tecnología e 
Innovación , generando incentivos tributarios a las empresas que se 
ubiquen allí y apalancando proyectos ancla a través del Fondo de 
Innovación, Tecnología e Industrias Creativas (FITIC). Como parte del 
Distrito, promoveremos un Centro de Innovación y Negocios  que 
lidere la articulación del ecosistema de ciencia, tecnología e 
innovación de la ciudad y sea el detonante de un modelo de 
desarrollo, basado en la economía del conocimiento.  
 
120. Destinaremos recursos propios y  gestionaremos recursos de regalías 
para que el Fondo de Innovación, Tecnología e Industrias Creativas 
(FITIC)  llegue al 1% del presupuesto de inversión durante todo el 
periodo de gobierno."
"PROGRAMA DE GOBIERNO  ‘BOGOTÁ PARA LA GENT E’ 	36 
	
Infraestructura para la Competitividad  
 
121. Promoveremos con el Gobierno Nacional, la Gobernación de 
Cundinamarca y lo s Alcaldes de los municipios vecinos, el diseño de 
un Sistema Logístico Regional  que cuente con una infraestructura vial 
para carga.  
 
122. Fomentaremos el aprovechamiento de los corredores férreos de la 
ciudad  y su habilitación para el transporte de carga integ rado a un 
Sistema Logístico Regional . Con trenes en la ciudad tendremos menos 
camiones, más movilidad y menos contaminación.  
 
123. Haremos realidad la Plataforma Logística Alimentaria  que integre a  
Bogotá y a los demás municipios de la Región Metropolitana de la 
Sabana para mejorar el acceso a alimentos y la seguridad alimentaria 
en general de la ciudadanía.  
 
124. Pondremos en funcionamiento la red de fibra óptica extendida  por la 
ETB con las conexiones faltantes de última milla para micro, pequeñas 
y medianas empre sas. 
 
 
Educación para toda la vida  
 
125. Bogotá será una ciudad educadora en la que el proceso de 
aprendizaje pueda desarrollarse a lo largo del ciclo vital de las 
personas. El sistema educativo y los servicios de formación 
promovidos por el distrito estarán di rigidos al desarrollo de 
capacidades en todas las etapas de la vida.  Promoveremos un modelo 
educativo incluyente que incentive la participación de niños y niñas en 
condiciones de igualdad en todas las áreas del conocimiento."
"PROGRAMA DE GOBIERNO  ‘BOGOTÁ PARA LA GENT E’ 	37 
	
126. Lideraré un modelo educativo de calidad  que le permita a niños, niñas 
y adolescentes, explorar su creatividad, conectarse con sus vocaciones 
y prepararse para las transformaciones del mundo contemporáneo. 
Haré un énfasis especial en la adopción de procesos pedagógicos en 
áreas STEAM,  por su sigla en inglés (Ciencia, tecnología, ingeniería, 
artes y matemáticas), por proyectos y en habilidades  blandas y  
socioemocionales.  
 
127. Fortaleceremos el acompañamiento psicosocial en las Instituciones 
Educativas  y promoveré actividades de cambio compor tamental en 
niños, niñas y adolescentes frente a dinámicas como la discriminación, 
la violencia, el consumo de sustancias psicoactivas y el embarazo.  
 
128. Aumentaremos el número  de estudiantes  de Instituciones Educativas 
en Jornada Única  y apoyaré el mejorami ento de sus procesos 
educativos mediante la diversificación (incluyendo actividades STEAM) 
y ampliación de la cobertura del Tiempo Escolar Complementario.  
 
129. Ampliaremos la cobertura del Tiempo Escolar Complementario  y 
diversificaremos el servicio  incluyend o programas STEAM en 
contra jornada para niños, niñas y adolescentes de I nstituciones 
Educativas que estén por fuera de la Jornada Única.  
 
130. Adelantaremos un Programa Especial de Acompañamiento para 
Instituciones Educativas Rurales , que permita fortalecer la  
infraestructura rural, que vincule a las familias al proceso de 
aprendizaje y promueva conocimientos aprovechables en la ruralidad y 
asociados a la protección del hábitat.  
 
131. Implementaremos modelos educativos flexibles  para niños, niñas, 
adolescentes y jóv enes desescolarizados que les facilite acceso al 
conocimiento y el desarrollo  de sus capacidades."
"PROGRAMA DE GOBIERNO  ‘BOGOTÁ PARA LA GENT E’ 	38 
	
 
132. Ampliaremos la cobertura de la educación inicial  con la mayor calidad 
posible, cualificando el talento humano e introduciendo modelos 
pedagógicos que potenci en las capacidades de apr endizaje en la 
primera infancia, y  fortaleceremos los  procesos pedagógicos de la 
atención dirigida al cuidado de niños y niñas hasta los 4 años.  
Mejoraremos y aumentaremos la infraestructura de Jardines Infantiles 
e Instituciones E ducativas Oficiales  y desarrollaremos en ellas 
intervenciones integrales de arte, cultura, ciencia y tecnología.  
 
133. Crearemos una Escuela de Maestros y Maestras del Distrito  para 
potenciar sus competencias y habilidades y mejorar así el impacto de 
su labor en el aula. El sistema tendrá nodos en todas las localidades y  
promoverá procesos de formación situada, investigación e innovación 
en pedagogía asociados al aula.  
 
134. Junto con las Universidades, trabajaremos en el mejoramiento de los 
programas de pregrado de licenciatura, y ampliaremos el apoyo 
económico para el acceso a estos programas y a los de Maestría en 
áreas de educación y pedagogía.  
 
135. Crearemos semilleros de emprendimiento en la Educación Media . 
Ampliaremos la cobertura de la Media Técnica y diversi ficaremos su 
oferta a través de alianzas con el sector productivo, las Instituciones de 
Educación Superior y las de Educación para el Trabajo y el Desarrollo 
Humano (ETDH), articuladas con laboratorios de innovación y con 
circuitos locales de emprendimient o. La orientación y el 
acompañamiento a los estudiantes será definitiva para prevenir la 
deserción en y hacia la educación media.  
 
136. Promoveremos el acceso y la calidad en la ETDH . Vigilaremos con la 
mayor rigurosidad la calidad de programas e instituciones,  y lideraré"
"PROGRAMA DE GOBIERNO  ‘BOGOTÁ PARA LA GENT E’ 	39 
	
acuerdos con la participación del sector productivo para la creación y 
financiación de proyectos productivos, que incluyan la formación de 
talento humano de jóvenes, adultos y personas mayores , 
especialmente en áreas priorizadas en la Estrategi a de Especialización 
Inteligente.  
 
137. Promoveremos un programa de nivelación académica y preparación 
para la educación superior  para jóvenes, adultos y personas mayores 
de la ruralidad y de las personas con menores ingresos de todas las 
localidades.  
 
138. Amplia remos la  cobertura de la Educación Superior  y mejoraremos el 
acceso de los jóvenes,  en las localidades con menor tasa de asistencia 
a través de un mecanismo de financiación contingente al ingres o y el 
otorgamiento de beca -crédito . Se priorizarán los progra mas 
relacionados con las necesidades de capital humano de la Estrategia 
de Especialización Inteligente.  
 
139. Los beneficiarios de programas de acceso a la Educación Superior de 
la Alcaldía tendrán acompañamiento psicosocial para prevenir la 
deserción y para me jorar su inserción laboral , a través de alianzas con 
el sector productivo.  
 
140. Promoveremos la contratación de mano de obra calificada y no 
calificada  del área de influencia de las obras, así como la contratación 
de un porcentaje de  personas con discapacidad y jóvenes recién 
egresados de programas de Educación Superior (técnicos, 
tecnológicos y profesionales) para promover el primer empleo.  
 
141. Fomentaremos la cualificación de jóvenes, adultos y personas mayores  
a través de programas presenciales y virtuales de f ormación en 
competencias."
"PROGRAMA DE GOBIERNO  ‘BOGOTÁ PARA LA GENT E’ 	40 
	
 
142. Promoveremos el fortalecimiento de los museos de la ciudad , su 
articulación con el sistema educativo y la ampliación de su cobertura 
territorial  
 
143. Apoyaremos los le mejoramiento continuo de la calidad en los 
procesos misionales de  la Universidad Distrital, docencia, investigación 
y extensión, y generaremos un mayor acceso de las personas a sus 
programas de educación superior con un criterio de justicia territorial."
"PROGRAMA DE GOBIERNO  ‘BOGOTÁ PARA LA GENT E’ 	41 
	
 
IV. Bogotá justa, diversa y solidaria  
 
Finanzas justas y equita tivas para superar la pobreza  
 
144. Implementaremos un sistema justo y equitativo  para el pago de 
impuestos , basado en la capacidad de pago.  Debemos superar el 
modelo de la estratificación en la ciudad.  
 
145. Focalizaremos la atención integral del Distrito y la cola boración del 
sector privado, para superar la pobreza extrema  a través de un modelo 
que combine el apoyo directo mediante subsidios y el desarrollo de 
capacidades. Fortaleceremos los mecanismos de identificación de 
riesgos de pobreza extrema para actuar sob re ellos a partir de un 
enfoque preventivo .  
 
146. Implementaremos una política  de subsidio  a los  pasajes en el 
Transporte Público  (Troncal y Zonal) a personas de SISBEN 1 y 2, 
estudiantes, personas mayores, personas co n discapacidad y sus 
cuidadores, siempre y  cuando se cuente con una fuente de 
financiación que no ponga en riesgo la estabilidad financiera del 
sistema.  
 
147. Apoyaremos iniciativas innovadoras de microcrédito  que permitan 
acabar con el “gota a gota”.  
  
 
Acción Integral Territorial  
 
148. Fortaleceré la estr ategia de abordaje territorial  como principal 
herramienta para la construcción de tejido social en zonas urbanas"
"PROGRAMA DE GOBIERNO  ‘BOGOTÁ PARA LA GENT E’ 	42 
	
priorizadas por la Alcaldía y en zonas rurales. Este modelo será el 
vehículo para llevar la Acción Integral del Gobierno Distrital.  
 
149. Fortalecer emos los mercados campesinos , los cuales se realizarán en 
todas las localidades, como apoyo a la seguridad alimentaria de los 
bogotanos y fuente de ingresos de dicha población.  
 
150. Aumentaremos la infraestructura de Centros Día y Centros Noche  con 
criterio de  equidad territorial y fortaleceremos la atención en salud y 
procesos de alfabetización básica y digital para personas mayores,  
articulados a la estrategia de emprendimiento.  
 
151. Ampliaremos la estrategia de Prevención y Atención Integral del 
Fenómeno de Habi tabilidad en Calle , mediante procesos de 
deshabituación del consumo de sustancias psicoactivas y atención a 
patologías mentales y físicas. Promoveremos proyectos de formación, 
emprendimiento e inserción laboral y el desarrollo de capacidades de 
habitantes de calle en los Centros Día y Centros Noche.  
 
152. Fortaleceremos los programas de apoyo a cuidadores de personas 
mayores y personas con discapacidad , que incluirán ofertas de 
atención básica en salud, orientación biopsicosocial y entrenamiento 
en actividades l údicas y pedagógicas.  
 
153. Ampliaremos la infraestructura para la atención a la primera infancia en 
los territorios donde más se necesite.  
 
154. Garantizaremos que haya un  Casa  de Juventud  en cada  localid ad y 
que todas se integren a los circuitos locales de empren dimiento y al 
Sistema Distrital de Apoyo al Emprendimiento."
"PROGRAMA DE GOBIERNO  ‘BOGOTÁ PARA LA GENT E’ 	43 
	
Respeto, Diversidad  e Inclusión  
 
155. Lideraré una estrategia contra la discri minación a personas LGB T, 
basada  en procesos de transformación de imaginarios , especialmente 
en servidores públicos y mie mbros de la Policía Metropolitana . 
Mejoraremos la capacidad de orientación, acompañamiento y 
respuesta a la vulneración de derechos de las personas LGBTI  
 
156. Impulsaremos proyectos de emprendimiento social liderados por 
personas mayores , orientados a generar valor público en asuntos 
culturales, recreativos y artísticos, ambientales, agrícolas y de ornato.  
 
157. Fomentaré , a través del Sistema Distrital de Apoyo al Emprendimiento, 
las prácticas productivas tradicionales  de los grupos étnicos , como las 
artesanías y l a gastronomía, y promoveré la consolidación de clústeres 
culturales en todas las localidades en los que se visibilicen las prácticas 
productivas tradicionales. Como parte de esta iniciativa, promoveré la 
creación del Centro Cultural de los Pueblos Indígena s. 
 
158. Promoveré el diseño e implementación de una política migratoria, 
liderada por una gerencia de alto nivel, para el optimo 
aprovechamiento del capital humano de los migrantes a través de una 
mejor integración a la sociedad y su adecuada regularización. También 
impulsaré una estrategia de pedagogía ciudadana contra la 
discriminación y la transformación de imaginarios  de servidores 
públicos, sector productivo y ciudadanía en general frente a la 
población extranjer a. L a participación activa de migrantes en 
proyectos de emprendimiento social y comunitario será un elemento 
fundamental de nuestra estrategia."
"PROGRAMA DE GOBIERNO  ‘BOGOTÁ PARA LA GENT E’ 	44 
	
Solidaridad: desde niños a personas mayores  
 
159. Mejoraremos el servicio de las comisarías de familia , en lo relacionado 
con la orientación psicosocial, la trazabilidad y el seguimiento a cada 
caso.  Muy especialmente fortaleceremos el acompañamiento del 
Distrito a las mujeres víctimas de violencia de gé nero y aumentaremos 
la capacidad, diversificaremos y mejoraremos la atención en  las Casas 
Refugio de la Secr etaría de la Mujer.  
 
160. Construiremos un Plan de Atención para niños, niñas y adolescentes (6 
a 14 años)  que permita unificar las estrategias de las distintas 
entidades del distrito, y concentre los esfuerzos en la prevención de 
consumo de drogas,  violencia,  embarazo adolescente y promueva el 
desarrollo de sus capacidades.  
 
161. Promoveremos la creación de servicios de apoyo especializado s para 
la educación de niños, niñas y adolescentes en condición de 
discapacidad  en cada localidad de acuerdo al tamaño de la poblaci ón 
que requiera el servicio,  y mejoraremos la capacitación de los maestros 
para una educación incluyente. En estas instituciones, el modelo 
pedagógico debe estar constituido bajo el Diseño Universal del 
Aprendizaje y los Planes Individuales de Ajustes Razonables  
 
162. Reforzaremos la  Política Distrital de Discapacidad , restableciendo de 
manera efectiva los derechos económicos, sociales y culturales de 
dicha población.  
 
163. Promoveremos la conformación de redes comunitarias del cuidado a la 
primera infancia, personas con disc apacidad y personas mayores , 
apoyadas por estrategias de servicios distritales itinerantes y de 
generación de mutuo cuidado."
"PROGRAMA DE GOBIERNO  ‘BOGOTÁ PARA LA GENT E’ 	45 
	
164. Fortaleceremos los procesos de formación in situ a personas 
dedicadas al cuidado  y la implementación de modelos pedagógicos, 
dirigidos a potenciar las capacidades de aprendizaje de niñ os y niñas 
entre los 0 y 5 años, especialmente en los entornos familia, jardín, 
escuela y espacio público.  
 
165. Fortaleceremos los Jardines Nocturnos y los Centros Amar  con el 
propósito de mejorar la calida d y aumentar su cobertura, para apoyar 
a los padres que trabajan en horario nocturno y fines de semana.  
 
166. Promoveremos que los Centros Amar , dirigidos al cuidado de niños, 
niñas  y jóvenes en riesgo de trabajo infantil, amplíen su servicio los 
fines de sema na para la atención de la primera infancia.  
 
167. Incluiremos el entorno espacio público dentro del modelo pedagógico 
de atención a la infancia  para potenciar el desarrollo de nuevas y 
mejores capacidades en nuestros niños y niñas.  
 
168. Diseñaremos e implementaremo s, en alianza con organismos de 
cooperación internacional, un Plan de Becas de Educación Superior 
para beneficiar a jóvenes líderes comunitarios y sociales  de bajos 
ingresos, que han desarrollado proyectos sociales de alto impacto en 
diferentes sectores y localidades de Bogotá.  
 
 
Formalización incluyente  
 
169. Llevaremos a cabo un plan de concertación y diálogo social con los 
vendedores informales  y promoveremos su vinculación a los procesos 
de emprendimiento social y comunitario del Sistema Distrital de 
Apoyo al Emprendimiento."
"PROGRAMA DE GOBIERNO  ‘BOGOTÁ PARA LA GENT E’ 	46 
	
170. Promoveremos alianzas con el sector productivo para la inserción 
laboral , que incluyan procesos de acompañamiento psicosocial y 
formación para el trabajo, especialmente en las áreas de la Estrategia 
de Especialización Inteligente. Gener aremos incentivos tributarios a las 
empresas que generen empleo formal y vinculen laboralmente a 
población vulnerable.  
 
 
Paz y reconciliación  
 
171. Crearemos Centros de Encuentro  donde además de realizar los 
trámites de Registro Único de Víctimas sean espacios de construcción 
de memoria histórica, con el concurso de la población desmovilizada y 
los migrantes.  
 
172. Implementaremos un modelo de integración local para las personas 
víctimas del conflicto armado que incluirá acceso priorizado de las 
víctimas a la oferta social, ejercicios de integración comunitaria, y 
oportunidades socio -productivas sostenibles.  
 
173. Trabajaremos de la mano con la Agencia para la Reincorporación y la 
Normalización (ARN) para la atención a excombatientes , a través de la 
generación de acciones de integración comunitaria a lo largo de la 
ciudad, así como formalizar un canal de acceso a la oferta Distrital para 
esta población."
"PROGRAMA DE GOBIERNO  ‘BOGOTÁ PARA LA GENT E’ 	47 
	
 
 
V. Bogotá planeada, saludable y sostenible  
 
Planeación urbana al servicio de la gente  
 
174. Implementaremos una estrategi a de divulgación del Plan de 
Ordenamiento Territorial , por medio de un lenguaje claro y sencillo al 
ciudadano, lo que permitirá una discusión más amplia, informada y 
legítima de este instrumento de ordenamiento territorial.  
 
175. Construir emos  una agenda común con los municipios de la región  que 
permita la formulaci ón e implementac ión de  políticas  espec íficas de 
manera coordinada en el marco de la  región capital.  
 
176. Promoveremos junto con los muni cipios de la Sabana de Bogotá, la 
Gobernación de Cundinamarca y el Congreso de la República, la 
creación de la Región Metropolitana de la Sabana de Bogotá , con 
funciones de autoridad en materia de planeación, movilidad, 
seguridad alimentaria, medio ambient e y seguridad.  
 
177. Lideraremos la formulación de un Plan Estratégico Metropolitano de 
Ordenamiento Territorial para la Región Metropolitana  de la Sabana 
de Bogotá, que permita poner en marcha un modelo de ocupación del 
territorio a partir del potencial y voca ción de la red de ciudades.  
 
178. Fortaleceremos los Instrumentos de seguimiento y evaluación al Plan 
de Ordenamiento Territorial (POT) ; aseguraremos los recursos ciertos y 
prioritarios en el Plan de Desarrollo para la materialización de los 
proyectos estratégi cos de corto plazo estipulados del POT."
"PROGRAMA DE GOBIERNO  ‘BOGOTÁ PARA LA GENT E’ 	48 
	
179. Simplificaremos los trámites para facilitar la formulación y ejecución de 
Planes Parciales de Renovación Urbana.  
 
180. Priorizaremos Planes Parciales de Renovación Urbana, con enfoque 
social, que se desarrollen en las c entralidades urbanas de la ciudad 
para la generación de vivienda cerca a los lugares de trabajo.   
 
181. Revisaremos la meta de vivienda del POT a la luz de los resultados del 
Censo.  
 
182. Impulsaremos las instancias de coordinación para la articulación y 
operación  de la Región Central de Planeación Estratégica (RAPE).  
 
 
Hábitat para Todos  
 
183. Promoveremos la construcción de  70.000 unidades de vivienda de 
interés social y prioritario  y destinaremos el 10% para Víctimas del 
conflicto armado.  
 
184. Articularemos las política s de Mejoramiento Integral y de Legalización 
de barrios  para brindar servicios públicos y sociales que mejoren su 
calidad de vida.   
 
185. Promoveremos la utilización de vivienda usada  para disminuir el déf icit 
cuantitativo en la ciudad.  
 
186. Daremos prevalencia a  la realización de presupuestos participativos en 
los proyectos de mejoramiento integral de barrios ; las prioridades de 
inversión se decidirán con la gente. Desde el Programa de 
Mejoramiento Integral de Barrios, promoveremos el control social y las"
"PROGRAMA DE GOBIERNO  ‘BOGOTÁ PARA LA GENT E’ 	49 
	
veedurí as ciudadanas para fortalecer los procesos de participación y 
apropiación de los residentes.  
 
187. Desarrollaremos Laboratorios de Construcción Social del Hábitat  con 
estrategias de arraigo territorial donde trabajen conjuntamente las 
comunidades, la academia y  la institucionalidad para el mejoramiento 
de la calidad de vida en los barrios y en los nuevos proyectos de 
vivienda de interés social y prioritario.  
 
188. Promoveremos el desarrollo de proyectos desde el enfoque de 
Acupuntura Urbana  que revitalicen espacios a l interior de los barrios y 
permitan mejorar las condiciones socio -económicas y ambientales del 
entorno.   
 
189. Priorizaremos dentro del Programa de Mejoramiento de Vivienda  el 
reforzamiento estructural de inmuebles en aras de disminuir la 
vulnerabilidad a eve ntos sísmicos de la ciudad. También priorizaremos 
intervenciones que permitan una mejor calidad de vida de las 
personas con discapacidad y sus cuidadores y aquellas que permitan 
un mejor uso del agua y de la energía eléctrica  
 
190. Fortaleceremos con la gente l a Política Pública de Ruralidad , que 
