"PROGRAMA DE GOBIERNO  ‘BOGOTÁ PARA LA GENT E’ 	1 
garantice la dignidad de los ciudadanos residentes en las zonas rurales 
de Bogotá.  
 
191. Implementaré una estrategia de modernización energética en 
equipamientos públicos que implemente tecnología fotovoltaica y 
comenzaré la s primeras fases de un sistema de alumbrado público 
inteligente."
"PROGRAMA DE GOBIERNO  ‘BOGOTÁ PARA LA GENT E’ 	50 
	
Cuidado de la Vida  
 
192. Con acompañamiento de la Secretaría de Salud y el Instituto de 
Recreación y Deporte, generaremos una oferta pública alrededor de la 
práctica de actividades físicas  en los parques de los barrios que 
contribuya a promover hábitos saludables y a mejorar prácticas de 
nutrición y estados de salud.  
 
193. Aumentaremos el número de gestores de riesgo para acercar la salud 
a los hogares  de los bogotanos con un enfoque de promoción de  
hábitos saludables y prevención de la enfermedad.  
 
194. Mantendremos el nivel de 0 muertes por desnutrición infantil y 
disminuiremos las muertes de niños menores de 5 años.  
 
195. Fortaleceremos la atención en salud a madres gestantes  a través de 
programas de medi cina preventiva, apoyados en herramientas TIC y 
atención especializada en parto.  
 
196. Promoveremos programas durante cada etapa del ciclo de vida para la 
generación de hábitos saludables, disminución de la incidencia y 
prevalencia de obesidad , riesgo cardiovas cular, patologías 
respiratorias y estados nutricionales , apoyados en TIC y la integración 
de la oferta de salud y de recreación y deporte.  
 
197. Haremos énfasis en estrategias de en vejecimiento activo y saludable  
para prevenir enfermedades y aumentaremos la oferta de acti vidades 
propiciando espacios de encuentro amables para personas mayores.  
 
198. Impulsaremos el uso de las TIC para el autodiagnóstico, manejo y 
control de enfermedades cardiovasculares y metabólicas  como"
"PROGRAMA DE GOBIERNO  ‘BOGOTÁ PARA LA GENT E’ 	51 
	
hipertensión y diabetes que son las principa les causas de mortalidad 
en el Distrito.  
 
199. Asumiremos el consumo de drogas como un asunto de salud pública . 
Promoveremos la reducción del consumo especialmente en 
adolescentes y jóvenes desde la prevención comunitaria y 
generaremos los mecanismos necesario s en la red pública para la 
deshabituación y disminución de daños en consumidores 
problemáticos.  
 
200. Promoveremos y fortaleceremos programas de educación sexual y 
reproductiva  en pro de reducir el embarazo adolescente, prevenir el 
contagio y realizar el diag nóstico oportuno de Enfermedades de 
Transmisión Sexual.  
 
201. Implementaremos una estrategia masiva de seguridad nutricional  en 
primera infancia y persona mayor impulsando la formación comunitaria 
en manipulación y preparación de alimentos saludables para garan tizar 
el aporte nutricional necesario en los casos de desnutrición y una 
adecuada alimentación para prevenir la obesidad.  
 
202. Implementaremos programas educativos de autoestima, autocuidado, 
autoprotección y psicología sexual ; estas acciones serán ejecutadas en 
escuelas, colegios, universidades y centros educativos públicos y 
privados.  
 
 
Atención y protección  
 
203. Avanzaremos en la integración de la red pública y privada de salud  
para robustecer y fortalecer la prestación del servicio en todo el"
"PROGRAMA DE GOBIERNO  ‘BOGOTÁ PARA LA GENT E’ 	52 
	
distrito, mejorar  y ampliar la capacidad de respuesta, reducir el déficit 
de camas y desarrollar una estrategia de prevención a mayor escala.  
 
204. Brindaremos con enfoque interdisciplinario el tratamiento integral de 
todas las patologías mentales  con un enfoque específico en d epresión 
y suicidio, alcoholismo y drogadicción que involucre la integración de 
sectores de salud y educación públicos y privados; así como el 
acompañamiento y soporte entre Entes y Familia o Red de Apoyo 
Próxima, teniendo en cuenta a la familia como núcle o y pilar en todo 
sentido y para toda condición .  
 
205. Fortaleceremos la implementación del modelo de atención primaria 
altamente resolutivo , así como la garantía de un servicio oportuno y de 
calidad en todos nuestros centros de atención contribuyendo a la 
disminución de la congestión de los servicios de urgencias y facilitando 
el acceso a los servicios de salud en las Localidades.   
 
206. Implementaremos un modelo de gestión de recursos responsable en 
el sector salud  que contribuya a la sostenibilidad financiera de  las 
subredes así como de Capital Salud.  
 
207. Mejoraremos la prestación del servicio y la calidad de la atención de 
las empresas sociales del Distrito , reduciendo los tiempos de espera 
de atención en todos los niveles de complejidad, exámenes, 
procedimientos y  mejorando la entrega de medicamentos.  
 
208. Fortaleceremos el acceso a los servicios de salud a través de la 
ampliación de la red pública construyendo nuevos hospitales y 
aumentando la cantidad y la capacidad de los CAPS , especialmente, 
en aquellos territorios  de menor cobertura."
"PROGRAMA DE GOBIERNO  ‘BOGOTÁ PARA LA GENT E’ 	53 
	
209. La atención primaria en salud  contará con especialidades básicas 
“Médicos Especialistas” en los sitios más deficitarios y de menor 
cobertura.  
 
210. Promoveremos un programa de fortalecimiento de capacidades en los 
equipos de salud de la r ed distrital  de acuerdo con el perfil 
epidemiológico de las subredes y de la ciudad.  
 
211. En conjunto con la Secretaría de Educación, generaremos 
oportunidades de acceso a programas de especialidades de ciencias 
de la salud  para garantizar la suficiencia de t alento humano y que 
favorezca la implementación del modelo de salud.  
 
212. Triplicaremos el número de atenciones domiciliarias  a fin de disminuir 
la ocupación de los servicios de urgencia, promover el acortamiento 
de los tiempos de espera de citas, optimizar l a calidad y oportunidad 
en atención en salud y así, llegar a la población más necesitada y con 
movilidad reducida.  
 
213. Mejoraremos la atención de enfermedades crónicas  a través de 
programas de motivación, controles y seguimiento al tratamiento y 
fortaleceremo s la entrega de medicamentos a domicilio.  
 
214. Garantizaremos que haya personal capacitado en atención de primer 
respondiente en salud en todas las estaciones de Transmilenio . 
 
 
Un aire saludable  
 
215. Apoyaremos mecanismos para el acceso a créditos blandos y 
gene raremos incentivos tributarios a las empresas que implementen 
tecnologías limpias  así como a las que mejoren su desempeño y"
"PROGRAMA DE GOBIERNO  ‘BOGOTÁ PARA LA GENT E’ 	54 
	
transfieran este tipo de tecnología a los eslabones de sus cadenas 
productivas.  
 
216. Adelantaremos un plan ambicioso de siembra de un mi llón de 
especies nativas de árboles . Se priorizarán las localidades con menor 
número de árboles por persona y se trabajará con la comunidad de 
manera participativa y aprovechando las TIC para la identificación de 
los lugares dónde deben sembrarse. La parti cipación ciudadana será 
fundamental para el apadrinamiento, disfrute y cuidado de cada árbol 
y para que se mantenga un número mínimo de árboles por cada 
localidad.  
 
217. Formularemos un Plan Integral para la Gestión de la Calidad del Aire  
con la participación d e los municipios de Cundinamarca, los gremios 
económicos y organizaciones sociales en el que se asuman 
compromisos conjuntos para reducir las emisiones de partículas 
contaminantes y se facilite el seguimiento a su cumplimiento por parte 
de la ciudadanía.  
 
218. Expandiremos la Red de Monitoreo de Calidad del Aire  para mejorar 
su cobertura y nos apoyaremos en tecnología para monitorear y 
controlar los corredores de movilidad más transitados.  
 
219. Promoveremos y facilitaremos la denuncia ciudadana, a través de 
canales  virtuales, de casos de vehículos y empresas contaminantes  y 
generaremos mecanismos de acción inmediata para sancionar a los 
infractores. Vamos a concentrar la institucionalidad del Distrito en la 
protección del medio ambiente y reforzaremos operativos de control 
en todas las localidades.  
 
220. Generaremos un plan de incentivos para la reconversión tecnológica 
del sector productivo y de transporte  para que adopten energías más"
"PROGRAMA DE GOBIERNO  ‘BOGOTÁ PARA LA GENT E’ 	55 
	
limpias. Estos inventivos estarán acompañados de un plan de apoyo 
financiero apalanca do en el Fondo de Innovación, Tecnología e 
Industrias Creativas del Distrito, con una participación activa de 
Universidades y Centros de Investigación que permitan la 
transformación de los modelos productivos de las empresas.  
 
221. Garantizaremos que todos los buses adquiridos tanto para el 
componente troncal co mo para el zonal utilicen tecnologías limpias . 
Priorizaremos aquellas tecnologías que generen un menor impacto 
ambiental tanto en su uso como su disposici ón final una vez complete 
su vida util.  
 
222. Promoveré incentivos y mecanismos de apoyo financiero para  
aumentar la  flota de t axis eléctricos en la ciudad para convertirla en la 
más grande del país.  
 
223. Brindaremos las condiciones para garantizar que el parque automotor 
que provee servicios al Distrito funcione con energías limpias  y tengan 
puntos de carga rápida en distintos puntos  de la ciudad.   
 
224. Trabajaremos de la mano del sector privado para generar los 
incentivos y reglamentaciones necesarias para la creación de 
estaciones de venta de carga de electricidad  en todas las zonas de la 
ciudad.  
 
 
Ecocultura  del Reciclaje  
 
225. Bogotá no pue de seguir enterrando su basura. Formularemos un plan 
de corto, mediano y largo plazo que nos permita migrar hacia un 
modelo sostenible para la gestión integral de residuos sólidos  
centrado en el aprovechamiento."
"PROGRAMA DE GOBIERNO  ‘BOGOTÁ PARA LA GENT E’ 	56 
	
 
226. Promoveremos que en un futuro, el relleno Doña Juana sea un parque 
ecológico y fuente de generación energética , a partir de la 
transformación de residuos y su optimización operativa.  
 
227. Es urgente cambiar nuestros hábitos para disminuir nuestra producción 
de residuos y facilitar su aprovechamiento. Trabajaremos en el cambio 
de comportamiento desde los colegios, en los hogares y en las 
unidades productivas para mejorar el consumo de bienes y la 
separación en la fuente.  
 
228. Bogotá debe transitar hacia la eliminación de los plásticos de un solo 
uso. Trabaj aremos junto con las grandes superficies comerciales en la 
eliminación de los plásticos de un solo uso comenzando por los 
empaques de alimentos.  
 
229. Implementaremos un modelo de asistencia técnica, de formación y 
acompañamiento a organizaciones de reciclador es para mejorar su 
productividad y dignificar su trabajo.  
 
230. A través del Sistema de Apoyo al Emprendimiento, financiaremos 
proyectos productivos intensivos en tecnología dirigidos a generar 
valor a partir del aprovechamiento de residuos sólidos y la utiliza ción 
de desechos orgánicos para compostaje.  
 
 
Ambiente para la vida  
 
231. Fortaleceremos los servicios del Instituto Distrital de Protección y 
Bienestar Animal y crearemos una Red pública de atención veterinaria 
para perros y gatos en hogares de bajos ingresos , con la participación"
"PROGRAMA DE GOBIERNO  ‘BOGOTÁ PARA LA GENT E’ 	57 
	
de las Facultades de Medicina Veterinaria de la ciudad y que cuente 
con centros de atención local.  
 
232. Mejoraremos la dotación de Áreas Verdes  en las localidades con 
mayor déficit y su conectividad con la estructura ecológica principal a 
través del desarrollo de redes naturales; fortaleceremos la 
institucionalidad necesaria para la gestión de una gran red verde que 
sea referente mundial.  
 
233. Desarrollaremos procesos de formación y emprendimiento dirigidos a 
habitantes de la ruralidad  en ár eas relacionadas con la protección del 
medio ambiente.  
 
234. Adelantaremos una agenda de cooperación internacional en materia 
ambiental dirigida a mejorar las capacidades de la ciudad para 
enfrentar el cambio climático . 
 
235. Aumentaremos la cantidad de ecosistemas estratégicos protegidos y 
de interés ambiental para la ciudad.  
 
236. Avanzaremos en el saneamiento y recuperación del Ri o Bogotá  y en la 
protección del recurso acuífero de la Sabana de Bogotá.  Iniciaremos la 
construcción de la Planta de Tratamiento de Aguas Res iduales Canoas.  
 
237. Garantizaremos una  Zona Adecuada de Manejo y Protección 
Ambiental del Río Bogotá con miras a la creación de un Parque Lineal 
que promueva la apropiación, recuperación y cuidado del río Bogotá.  
 
238. Promoveremos el uso de nuevas tecnologías pa ra el tratamiento y 
aprovechamiento de aguas grises  en los proyectos de vivienda y en los 
mejoramientos de vivienda."
"PROGRAMA DE GOBIERNO  ‘BOGOTÁ PARA LA GENT E’ 	58 
	
239. Avanzaremos en una estrategia de renaturalización de los Cerros 
Orientales  a través del trabajo conjunto con la comunidad en la 
construcc ión de viveros, jardines y huertas urbanas.  
 
240. Promoveremos que el Área de Ocupación Pública Prioritaria de la 
Franja de Adecuación de los Cerros Orientales, que actúa como zona 
de amortiguación y de contención para la urbanización de los Cerros, 
sea un gra n Parque Metropolitano.    
 
241. Continuaremos con el proceso de recuperación integral de fuentes 
hídricas , en el marco de la Política Pública de Humedales."
